{
  "schema_version": "1.0",
  "review_id": "3c61d90479ef0023ab0a2e1db51fca15da98b8551a5fd1057ea3d509fe388664",
  "source_id": "siyavula-physical-sciences-g10-g12-ccby",
  "artifact_id": "siyavula-physical-sciences-g11-en-ccby-3d893a4364f5",
  "artifact_sha256": "3d893a4364f52efe1991360302cfccb06030e03ad67d725867fb48f0f177a0f9",
  "normalized_unit": "normalized/siyavula-physical-sciences-g10-g12-ccby/siyavula-physical-sciences-g11-en-ccby-3d893a4364f5/00758.json",
  "source_document": "OPS/xhtml/science11/11-electric-circuits-01.cnxmlplus.html",
  "chapter": "Chapter 11: Electric circuits",
  "section": "11.2 Ohm's Law > Using Ohm's Law > Worked example 1: Ohm's Law > Write the final answer",
  "asset_locator": "OPS/xhtml/science11/equation/053a4443794ecbf62fb31de925006465.png",
  "asset_kind": "math_image",
  "latex": "V = \\frac{I}{R}, = (1.5)(10) , = 15V",
  "plain_text": "ยกตัวอย่างคำนวณ V = IR , I = 1.5 , R = 10, V = 15V",
  "review_status": "verified",
  "reviewer": "Steve",
  "reviewed_at": "2026-10-01T10:26:21.610Z"
}
