{
  "schema_version": "1.0",
  "review_id": "e8318b8ece16c5829a4c87e8289daeb342851dcafe66a06c5252e4880010fb81",
  "source_id": "siyavula-physical-sciences-g10-g12-ccby",
  "artifact_id": "siyavula-physical-sciences-g11-en-ccby-3d893a4364f5",
  "artifact_sha256": "3d893a4364f52efe1991360302cfccb06030e03ad67d725867fb48f0f177a0f9",
  "normalized_unit": "normalized/siyavula-physical-sciences-g10-g12-ccby/siyavula-physical-sciences-g11-en-ccby-3d893a4364f5/00754.json",
  "source_document": "OPS/xhtml/science11/11-electric-circuits-01.cnxmlplus.html",
  "chapter": "Chapter 11: Electric circuits",
  "section": "11.2 Ohm's Law > Using Ohm's Law",
  "asset_locator": "OPS/xhtml/science11/equation/14779726770d4163b02b70dd770c4b29.png",
  "asset_kind": "math_image",
  "latex": "\\Omega",
  "plain_text": "ohm symbol",
  "review_status": "verified",
  "reviewer": "Steve",
  "reviewed_at": "2026-10-01T10:13:25.040Z"
}
