{
  "schema_version": "1.0",
  "review_id": "808febb76891a754bcd1253abe6e5c2a23fb8aff6f75fbaf750b8907fa56af81",
  "source_id": "siyavula-physical-sciences-g10-g12-ccby",
  "artifact_id": "siyavula-physical-sciences-g11-en-ccby-3d893a4364f5",
  "artifact_sha256": "3d893a4364f52efe1991360302cfccb06030e03ad67d725867fb48f0f177a0f9",
  "normalized_unit": "normalized/siyavula-physical-sciences-g10-g12-ccby/siyavula-physical-sciences-g11-en-ccby-3d893a4364f5/00758.json",
  "source_document": "OPS/xhtml/science11/11-electric-circuits-01.cnxmlplus.html",
  "chapter": "Chapter 11: Electric circuits",
  "section": "11.2 Ohm's Law > Using Ohm's Law > Worked example 1: Ohm's Law > Write the final answer",
  "asset_locator": "OPS/xhtml/science11/equation/68d8e8a9f08c6906db322d7123a00f5b.png",
  "asset_kind": "math_image",
  "latex": "6",
  "plain_text": "6",
  "review_status": "verified",
  "reviewer": "Steve",
  "reviewed_at": "2026-10-01T10:16:17.119Z"
}
