{
  "schema_version": "1.0",
  "review_id": "c7d97d61d05db97493d12e36612d8318d0b93e4dd06aa31a398a2536053bd919",
  "source_id": "siyavula-physical-sciences-g10-g12-ccby",
  "artifact_id": "siyavula-physical-sciences-g11-en-ccby-3d893a4364f5",
  "artifact_sha256": "3d893a4364f52efe1991360302cfccb06030e03ad67d725867fb48f0f177a0f9",
  "normalized_unit": "normalized/siyavula-physical-sciences-g10-g12-ccby/siyavula-physical-sciences-g11-en-ccby-3d893a4364f5/00754.json",
  "source_document": "OPS/xhtml/science11/11-electric-circuits-01.cnxmlplus.html",
  "chapter": "Chapter 11: Electric circuits",
  "section": "11.2 Ohm's Law > Using Ohm's Law",
  "asset_locator": "OPS/xhtml/science11/equation/958d8685992c1e383de8f53c8407b72d.png",
  "asset_kind": "math_image",
  "latex": "I = \\frac{V}{R}",
  "plain_text": "สมการ I = V/R",
  "review_status": "verified",
  "reviewer": "Steve",
  "reviewed_at": "2026-10-01T10:22:54.523Z"
}
