{
  "schema_version": "1.0",
  "review_id": "a1013684fa2750d61990434794cfa69144a5973b23aa32b9f5f7f163904b14ae",
  "source_id": "siyavula-physical-sciences-g10-g12-ccby",
  "artifact_id": "siyavula-physical-sciences-g11-en-ccby-3d893a4364f5",
  "artifact_sha256": "3d893a4364f52efe1991360302cfccb06030e03ad67d725867fb48f0f177a0f9",
  "normalized_unit": "normalized/siyavula-physical-sciences-g10-g12-ccby/siyavula-physical-sciences-g11-en-ccby-3d893a4364f5/00740.json",
  "source_document": "OPS/xhtml/science11/11-electric-circuits-01.cnxmlplus.html",
  "chapter": "Chapter 11: Electric circuits",
  "section": "11.2 Ohm's Law",
  "asset_locator": "OPS/xhtml/science11/equation/5206560a306a2e085a437fd258eb57ce.png",
  "asset_kind": "math_image",
  "latex": "V",
  "plain_text": "v = voltage",
  "review_status": "verified",
  "reviewer": "Steve",
  "reviewed_at": "2026-10-01T10:03:55.672Z"
}
