{
  "schema_version": "1.0",
  "review_id": "74e1f8be5b3dc378b0ae7b5c27f29351f91f7dd60a2b20b2cb9496953fa84bf7",
  "source_id": "siyavula-physical-sciences-g10-g12-ccby",
  "artifact_id": "siyavula-physical-sciences-g11-en-ccby-3d893a4364f5",
  "artifact_sha256": "3d893a4364f52efe1991360302cfccb06030e03ad67d725867fb48f0f177a0f9",
  "normalized_unit": "normalized/siyavula-physical-sciences-g10-g12-ccby/siyavula-physical-sciences-g11-en-ccby-3d893a4364f5/00758.json",
  "source_document": "OPS/xhtml/science11/11-electric-circuits-01.cnxmlplus.html",
  "chapter": "Chapter 11: Electric circuits",
  "section": "11.2 Ohm's Law > Using Ohm's Law > Worked example 1: Ohm's Law > Write the final answer",
  "asset_locator": "OPS/xhtml/science11/equation/342ffea4d95cf51e2920a3dc1b6e4241.png",
  "asset_kind": "math_image",
  "latex": "1.5",
  "plain_text": "1.5",
  "review_status": "verified",
  "reviewer": "Steve",
  "reviewed_at": "2026-10-01T10:18:25.994Z"
}
