{
  "schema_version": "1.0",
  "review_id": "8384d9781a6801e407c2c9620e8ba32a20da8b6bf5232e42570ecab3f57ee9d9",
  "source_id": "siyavula-physical-sciences-g10-g12-ccby",
  "artifact_id": "siyavula-physical-sciences-g11-en-ccby-3d893a4364f5",
  "artifact_sha256": "3d893a4364f52efe1991360302cfccb06030e03ad67d725867fb48f0f177a0f9",
  "normalized_unit": "normalized/siyavula-physical-sciences-g10-g12-ccby/siyavula-physical-sciences-g11-en-ccby-3d893a4364f5/00758.json",
  "source_document": "OPS/xhtml/science11/11-electric-circuits-01.cnxmlplus.html",
  "chapter": "Chapter 11: Electric circuits",
  "section": "11.2 Ohm's Law > Using Ohm's Law > Worked example 1: Ohm's Law > Write the final answer",
  "asset_locator": "OPS/xhtml/science11/equation/80989ddeab49bf024e2f9c2e41b7b470.png",
  "asset_kind": "math_image",
  "latex": "V",
  "plain_text": "voltage symbol",
  "review_status": "verified",
  "reviewer": "Steve",
  "reviewed_at": "2026-10-01T10:15:17.522Z"
}
