{
  "schema_version": "1.0",
  "review_id": "82a61445cc860e070b57349e4916c1ada4bce5e28a40a9e4f4b48e821d40a859",
  "source_id": "siyavula-physical-sciences-g10-g12-ccby",
  "artifact_id": "siyavula-physical-sciences-g11-en-ccby-3d893a4364f5",
  "artifact_sha256": "3d893a4364f52efe1991360302cfccb06030e03ad67d725867fb48f0f177a0f9",
  "normalized_unit": "normalized/siyavula-physical-sciences-g10-g12-ccby/siyavula-physical-sciences-g11-en-ccby-3d893a4364f5/00755.json",
  "source_document": "OPS/xhtml/science11/11-electric-circuits-01.cnxmlplus.html",
  "chapter": "Chapter 11: Electric circuits",
  "section": "11.2 Ohm's Law > Using Ohm's Law > Worked example 1: Ohm's Law",
  "asset_locator": "OPS/xhtml/science11/pspicture/115f62b5cb3bc58df40566ac68b62ca5.png",
  "asset_kind": "image",
  "latex": "",
  "plain_text": "วงจรที่มีสัญลักษณ์ power ด้านล่าง , R = resistor , V = แรงดันตกคร่อมระหว่าง In และ out ของ R และ A = กระแสท้ายวงจร",
  "review_status": "verified",
  "reviewer": "Steve",
  "reviewed_at": "2026-10-01T10:10:40.082Z"
}
