{
  "schema_version": "1.0",
  "review_id": "d7588c40c6ff5c753e1980aa8a379c32d7f74a67050ec7a0f359dbeb3f481278",
  "source_id": "siyavula-physical-sciences-g10-g12-ccby",
  "artifact_id": "siyavula-physical-sciences-g11-en-ccby-3d893a4364f5",
  "artifact_sha256": "3d893a4364f52efe1991360302cfccb06030e03ad67d725867fb48f0f177a0f9",
  "normalized_unit": "normalized/siyavula-physical-sciences-g10-g12-ccby/siyavula-physical-sciences-g11-en-ccby-3d893a4364f5/00740.json",
  "source_document": "OPS/xhtml/science11/11-electric-circuits-01.cnxmlplus.html",
  "chapter": "Chapter 11: Electric circuits",
  "section": "11.2 Ohm's Law",
  "asset_locator": "OPS/xhtml/science11/pspicture/ff9eaad1559c2750f07e8fc8ef30a0d1.png",
  "asset_kind": "image",
  "latex": "",
  "plain_text": "line graph shows relation between V (horizontal) , I (vertical) and R",
  "review_status": "verified",
  "reviewer": "Steve",
  "reviewed_at": "2026-10-01T10:06:29.299Z"
}
