{
  "schema_version": "1.0",
  "review_id": "ba09075c80e9426fc9d3c70a36f33629e58052d52fc2dd257c1a95776a292dc9",
  "source_id": "siyavula-physical-sciences-g10-g12-ccby",
  "artifact_id": "siyavula-physical-sciences-g11-en-ccby-3d893a4364f5",
  "artifact_sha256": "3d893a4364f52efe1991360302cfccb06030e03ad67d725867fb48f0f177a0f9",
  "normalized_unit": "normalized/siyavula-physical-sciences-g10-g12-ccby/siyavula-physical-sciences-g11-en-ccby-3d893a4364f5/00740.json",
  "source_document": "OPS/xhtml/science11/11-electric-circuits-01.cnxmlplus.html",
  "chapter": "Chapter 11: Electric circuits",
  "section": "11.2 Ohm's Law",
  "asset_locator": "OPS/xhtml/science11/equation/e1e1d3d40573127e9ee0480caf1283d6.png",
  "asset_kind": "math_image",
  "latex": "R",
  "plain_text": "R = Resistance (ohm)",
  "review_status": "verified",
  "reviewer": "Steve",
  "reviewed_at": "2026-10-01T10:04:03.347Z"
}
