{
  "schema_version": "1.0",
  "review_id": "0af01e2391925e7ca33a8aaf58bd7e4831eea4b2f2dbd152ef5a8930f559b4bc",
  "source_id": "siyavula-physical-sciences-g10-g12-ccby",
  "artifact_id": "siyavula-physical-sciences-g11-en-ccby-3d893a4364f5",
  "artifact_sha256": "3d893a4364f52efe1991360302cfccb06030e03ad67d725867fb48f0f177a0f9",
  "normalized_unit": "normalized/siyavula-physical-sciences-g10-g12-ccby/siyavula-physical-sciences-g11-en-ccby-3d893a4364f5/00740.json",
  "source_document": "OPS/xhtml/science11/11-electric-circuits-01.cnxmlplus.html",
  "chapter": "Chapter 11: Electric circuits",
  "section": "11.2 Ohm's Law",
  "asset_locator": "OPS/xhtml/science11/equation/fdbe69391435c6883c0b287174d22c41.png",
  "asset_kind": "math_image",
  "latex": "\\frac{I}{V} = \\frac{1}{R}",
  "plain_text": "I/V = 1/R",
  "review_status": "verified",
  "reviewer": "Steve",
  "reviewed_at": "2026-10-01T10:07:03.243Z"
}
