{
  "schema_version": "1.0",
  "review_id": "03a85da701c3ada629c479414e45074758f2cfe646779053f2ba5bd8de2baea0",
  "source_id": "siyavula-physical-sciences-g10-g12-ccby",
  "artifact_id": "siyavula-physical-sciences-g11-en-ccby-3d893a4364f5",
  "artifact_sha256": "3d893a4364f52efe1991360302cfccb06030e03ad67d725867fb48f0f177a0f9",
  "normalized_unit": "normalized/siyavula-physical-sciences-g10-g12-ccby/siyavula-physical-sciences-g11-en-ccby-3d893a4364f5/00755.json",
  "source_document": "OPS/xhtml/science11/11-electric-circuits-01.cnxmlplus.html",
  "chapter": "Chapter 11: Electric circuits",
  "section": "11.2 Ohm's Law > Using Ohm's Law > Worked example 1: Ohm's Law",
  "asset_locator": "OPS/xhtml/science11/equation/8649b53cb58ca3be9d670ff659b49286.png",
  "asset_kind": "math_image",
  "latex": "10",
  "plain_text": "10",
  "review_status": "verified",
  "reviewer": "Steve",
  "reviewed_at": "2026-10-01T10:10:44.823Z"
}
